Domaine,Sujet,Détails,Question 1,Réponse 1,Explication 1,Question 2,Réponse 2,Explication 2,Question 3,Réponse 3,Explication 3,Question 4,Réponse 4,Explication 4,Question 5,Réponse 5,Explication 5,Question 6,Réponse 6,Explication 6,Question 7,Réponse 7,Explication 7,Question 8,Réponse 8,Explication 8,Question 9,Réponse 9,Explication 9,Question 10,Réponse 10,Explication 10
Virtualisation et Datacenter,Hyperviseurs et Stockage,"Virtualisation, clustering, migration, stockage SAN, VSAN, NAS, DAS.",Qu'est-ce qu'un hyperviseur ?,Un logiciel qui permet de créer et d'exécuter des machines virtuelles.,Il isole le matériel physique des systèmes d'exploitation invités permettant ainsi de faire tourner plusieurs serveurs sur une seule machine physique.,Quelle est la différence entre un hyperviseur de Type 1 et de Type 2 ?,Le Type 1 s'installe directement sur le matériel alors que le Type 2 s'installe sur un système d'exploitation existant.,Le Type 1 (Bare Metal) comme VMware ESXi est plus performant car il n'a pas la surcharge d'un OS hôte contrairement au Type 2 comme VirtualBox.,Que signifie l'acronyme SAN ?,Storage Area Network ou réseau de stockage dédié.,C'est un réseau haute performance utilisé pour transférer des données entre des serveurs et des unités de stockage au niveau bloc.,Qu'est-ce qu'une machine virtuelle (VM) ?,Une émulation logicielle d'un ordinateur physique.,Une VM possède son propre processeur sa mémoire son disque et sa carte réseau tous virtualisés par l'hyperviseur.,Quelle est la différence principale entre un NAS et un SAN ?,Le NAS gère le stockage au niveau fichier alors que le SAN le gère au niveau bloc.,Un NAS se connecte au réseau local via Ethernet pour le partage de fichiers tandis qu'un SAN est vu par le serveur comme un disque local physique.,Qu'est-ce que le clustering de serveurs dans un environnement de virtualisation ?,Le regroupement de plusieurs serveurs physiques pour offrir une haute disponibilité.,Si un serveur physique du cluster tombe en panne les machines virtuelles qu'il hébergeait sont automatiquement redémarrées sur les autres serveurs du groupe.,Expliquez le concept de migration à chaud (Live Migration) ?,C'est le déplacement d'une machine virtuelle allumée d'un hôte physique à un autre sans interruption de service.,Cela permet d'effectuer la maintenance d'un serveur physique sans impacter les utilisateurs comme avec vMotion chez VMware.,Qu'est-ce que le iSCSI ?,Un protocole permettant de transporter des commandes SCSI sur un réseau IP.,Il permet de créer un SAN à moindre coût en utilisant l'infrastructure Ethernet existante au lieu de protocoles plus coûteux comme la Fibre Channel.,Quel est l'intérêt du RAID dans un système de stockage ?,Améliorer la tolérance aux pannes et les performances des disques.,En répartissant les données sur plusieurs disques physiques le RAID protège contre la perte d'un disque (RAID 5) ou accélère les accès (RAID 0).,Qu'est-ce que le VSAN (Virtual SAN) ?,Une solution de stockage logiciel qui agrège les disques locaux des serveurs pour créer un stockage partagé.,Cela permet de se passer d'une baie de stockage externe coûteuse en utilisant directement la capacité disque des serveurs du cluster.
Virtualisation et Datacenter,Datacenter,"Hyper-convergence, équipements matériels, gestion énergie et refroidissement.",Qu'est-ce qu'un Datacenter ?,C'est un lieu physique sécurisé regroupant des serveurs et du stockage.,Il assure la continuité de service des données grâce à une infrastructure électrique et climatique redondante.,Qu'est-ce qu'une baie (rack) informatique ?,Un châssis standardisé pour fixer les équipements réseaux et serveurs.,Elle permet une organisation optimale du câblage et une gestion efficace du flux d'air entre les machines.,À quoi sert un onduleur (UPS) dans un Datacenter ?,À fournir de l'énergie immédiatement en cas de coupure électrique.,Il protège le matériel contre les surtensions et assure le relais le temps que les groupes électrogènes prennent la relève.,Que signifie l'acronyme PUE (Power Usage Effectiveness) ?,C'est l'indicateur mesurant l'efficacité énergétique d'un Datacenter.,Plus le PUE est proche de 1 plus le Datacenter est efficace car il consomme peu d'énergie pour son refroidissement.,C'est quoi l'hyper-convergence (HCI) ?,Une architecture qui combine le calcul le stockage et le réseau dans un seul serveur.,Cela permet de simplifier la gestion du Datacenter en pilotant toute l'infrastructure par logiciel sur du matériel standard.,Expliquez le principe de l'allée chaude et de l'allée froide.,Il s'agit d'orienter les baies pour séparer l'air frais entrant de l'air chaud sortant.,Cette méthode évite les mélanges thermiques et permet de réduire drastiquement la consommation liée à la climatisation.,Quelle est la différence entre une infrastructure convergée et hyper-convergée ?,La convergée assemble des éléments matériels distincts alors que l'hyper-convergée est totalement pilotée par logiciel.,En hyper-convergence on ajoute simplement des nœuds identiques pour augmenter la puissance globale de manière horizontale.,Qu'est-ce que le Free Cooling ?,Une technique consistant à utiliser l'air extérieur pour refroidir le Datacenter.,C'est une solution écologique et économique qui réduit l'usage des climatiseurs quand la température extérieure est basse.,Que garantit la certification Tier 4 de l'Uptime Institute ?,Le plus haut niveau de résilience avec une disponibilité théorique de 99.995%.,Un Datacenter Tier 4 est entièrement redondant et tolérant aux pannes même durant les opérations de maintenance lourde.,Quelle est la différence entre un commutateur Top of Rack (ToR) et End of Row (EoR) ?,Le ToR se place en haut de chaque baie tandis que l'EoR centralise les connexions en bout de rangée.,Le ToR réduit considérablement la longueur des câbles réseau mais multiplie le nombre de commutateurs à gérer.
Virtualisation et Datacenter,Cloud Computing,"Modèles IaaS, PaaS, SaaS, Cloud public (Azure, AWS), privé, hybride, multicloud.",Quelle est la principale caractéristique du Cloud Public ?,Des ressources informatiques partagées entre plusieurs clients et accessibles via Internet.,Cela permet une scalabilité quasi infinie et un paiement à l'usage sans investissement matériel lourd initial.,Qu'est-ce que le Cloud Privé ?,Une infrastructure cloud dédiée exclusivement à une seule organisation.,Il offre un contrôle total sur les données et la sécurité mais nécessite une gestion interne plus importante et des coûts fixes plus élevés.,Comment définit-on le Cloud Hybride ?,Une solution combinant au moins un cloud privé et un cloud public fonctionnant ensemble.,Cela permet de garder les données sensibles sur site tout en profitant de la puissance de calcul du public pour les charges de travail variables.,Qu'est-ce que la stratégie Multi-cloud ?,L'utilisation simultanée de services provenant de plusieurs fournisseurs de cloud différents comme Azure et AWS.,Cette approche évite la dépendance à un seul fournisseur (vendor lock-in) et permet de choisir le meilleur service de chaque plateforme.,Dans le modèle IaaS que gère le client ?,Le système d'exploitation les applications les données et la configuration réseau.,Le fournisseur ne s'occupe que de la couche matérielle physique et de la virtualisation.,Quel est l'avantage du modèle PaaS pour les développeurs ?,Il permet de se concentrer uniquement sur le code sans gérer l'OS ou les mises à jour serveurs.,La plateforme fournit tout l'environnement nécessaire au déploiement des applications de manière automatisée.,Donnez un exemple courant de service SaaS.,Microsoft 365 ou Google Workspace.,Le logiciel est entièrement géré par le fournisseur et accessible directement via un navigateur web.,Qu'est-ce qu'un Hyperscaler ?,Un très grand fournisseur de cloud capable de déployer des ressources à une échelle mondiale massive.,Les trois principaux sont Amazon Web Services Microsoft Azure et Google Cloud Platform.,À quoi correspond le modèle de responsabilité partagée ?,À la répartition des tâches de sécurité entre le fournisseur de cloud et le client.,Plus on monte vers le SaaS plus le fournisseur assume de responsabilités alors qu'en IaaS le client en garde une grande partie.,Qu'est-ce que le concept de Cloud Bursting ?,Le basculement automatique de la charge de travail vers le cloud public lorsque le cloud privé atteint ses limites.,Cela permet de gérer des pics d'activité ponctuels sans avoir à surdimensionner l'infrastructure locale coûteuse.
Virtualisation et Datacenter,Environnements Cloud,"Déploiements type OpenStack, AzureStack, OpenNebula.",Qu'est-ce qu'OpenStack ?,Une plateforme logicielle libre permettant de déployer des infrastructures de cloud privé et public.,Elle orchestre les ressources de calcul de stockage et de réseau via un ensemble de projets modules comme Nova ou Neutron.,Quel est l'objectif principal d'Azure Stack ?,Permettre d'utiliser les services du cloud Azure directement dans un centre de données local.,Cela offre une expérience hybride cohérente pour les entreprises souhaitant garder certaines données sensibles sur site tout en utilisant les outils Microsoft.,Qu'est-ce qu'OpenNebula ?,Une solution open source légère pour la gestion et la virtualisation de centres de données.,Elle permet de transformer une infrastructure existante en un cloud privé ou hybride de manière simple et efficace.,Citez un avantage d'OpenStack par rapport aux solutions propriétaires.,Son absence de dépendance vis-à-vis d'un éditeur unique et sa grande flexibilité de configuration.,Étant open source il permet de construire une infrastructure sur mesure sans payer de licences onéreuses pour l'hyperviseur.,À quoi sert le projet Horizon dans OpenStack ?,C'est le tableau de bord web qui permet aux utilisateurs et administrateurs de gérer les ressources du cloud.,Il offre une interface graphique intuitive pour lancer des instances de machines virtuelles et configurer les réseaux.,Dans l'écosystème OpenStack quel est le rôle du module Nova ?,Il assure la gestion et l'orchestration des ressources de calcul (compute).,Nova est le moteur principal qui programme et crée les machines virtuelles sur les serveurs physiques de l'infrastructure.,Quelle est la différence entre Azure Stack Hub et Azure Stack HCI ?,Hub est une plateforme cloud complète et autonome alors que HCI est une solution d'hyper-convergence focalisée sur la virtualisation.,HCI est idéal pour moderniser l'infrastructure locale tandis que Hub reproduit fidèlement l'écosystème Azure public chez le client.,Quel projet OpenStack gère le stockage par blocs (block storage) ?,Le projet Cinder.,Cinder fournit du stockage persistant aux machines virtuelles en permettant de créer et d'attacher des volumes de données à la demande.,Qu'est-ce que le projet Neutron dans OpenStack ?,C'est le module chargé de fournir la connectivité réseau en tant que service (NaaS).,Il permet de créer des réseaux virtuels des routeurs et des pare-feu logiciels de manière dynamique pour les instances du cloud.,Pourquoi une entreprise choisirait-elle OpenNebula plutôt qu'OpenStack ?,Pour sa facilité d'installation et sa légèreté comparée à la complexité d'OpenStack.,OpenNebula est souvent privilégié par les organisations qui veulent un cloud privé fonctionnel rapidement sans nécessiter une équipe d'experts dédiée.
Virtualisation et Datacenter,Conteneurs et Orchestration,"Docker, dépôts (Docker Hub, Azure Container Registry), Kubernetes.",Qu'est-ce qu'un conteneur par rapport à une machine virtuelle ?,Un environnement léger qui partage le noyau de l'OS hôte contrairement à une VM qui embarque son propre système d'exploitation.,Cela permet de lancer des applications de manière isolée avec beaucoup moins de ressources et un démarrage quasi instantané.,Que fait la plateforme Docker ?,Elle permet d'empaqueter une application et ses dépendances dans une image standardisée exécutable partout.,Docker simplifie le déploiement en garantissant que l'application fonctionnera de la même manière sur le poste du développeur et sur le serveur de production.,À quoi sert un Dockerfile ?,C'est un fichier texte contenant les instructions pour construire une image Docker automatiquement.,Il définit l'image de base les fichiers à copier les commandes à exécuter et le port à exposer pour l'application sans intervention manuelle.,Qu'est-ce qu'un registre de conteneurs comme Docker Hub ?,Un serveur centralisé où sont stockées et partagées les images de conteneurs.,On y télécharge des images prêtes à l'emploi ou on y envoie ses propres créations pour les déployer sur n'importe quel serveur connecté.,Quel est le rôle principal de Kubernetes ?,Orchestrer et gérer le cycle de vie des conteneurs à grande échelle sur un cluster de serveurs.,Il automatise le déploiement la mise à l'échelle et la gestion de la haute disponibilité des applications conteneurisées.,Dans Kubernetes qu'est-ce qu'un Pod ?,C'est la plus petite unité d'exécution contenant un ou plusieurs conteneurs partageant le même stockage et le même réseau.,Les conteneurs au sein d'un même Pod communiquent entre eux via localhost et sont toujours déployés ensemble sur le même nœud physique.,À quoi sert l'outil Docker Compose ?,À définir et lancer des applications multi-conteneurs complexes à l'aide d'un seul fichier de configuration YAML.,Cela permet de démarrer en une seule commande toute une architecture comprenant par exemple un serveur web une base de données et un système de cache.,Qu'est-ce qu'un volume dans Docker ?,Un mécanisme permettant de rendre les données d'un conteneur persistantes même après l'arrêt ou la suppression de celui-ci.,Par défaut le stockage d'un conteneur est éphémère. Le volume permet de sauvegarder les données importantes comme celles d'une base de données sur le disque de l'hôte.,Quelle est la différence entre Azure Container Registry et Docker Hub ?,ACR est un registre privé sécurisé géré par Microsoft tandis que Docker Hub est le registre public mondial par défaut.,ACR permet aux entreprises de stocker leurs images propriétaires à proximité de leurs services cloud Azure pour des déploiements plus rapides et sécurisés.,Que signifie le concept de Self-healing dans Kubernetes ?,La capacité de l'orchestrateur à redémarrer automatiquement un conteneur s'il tombe en panne ou si son serveur physique échoue.,Kubernetes surveille en permanence l'état des Pods et recrée instantanément les instances manquantes pour garantir que le service reste toujours disponible.
Virtualisation et Datacenter,Hybridation et Migration,"Déplacer des services (VM, conteneurs) des infrastructures locales vers le cloud et inversement.",Qu'est-ce que la migration Lift and Shift (Rehosting) ?,C'est le déplacement d'une application ou d'une VM vers le cloud sans aucune modification logicielle.,C'est la méthode la plus rapide pour migrer mais elle ne profite pas pleinement des avantages natifs du cloud comme l'auto-scalabilité.,Que signifie le terme Réversibilité dans un contrat cloud ?,C'est la capacité technique et contractuelle de récupérer ses données et services pour les rapatrier en local ou chez un autre fournisseur.,La réversibilité est cruciale pour éviter la dépendance exclusive (lock-in) et doit être anticipée dès la conception de l'architecture.,À quoi sert l'outil Azure Migrate ?,C'est une plateforme centrale pour découvrir évaluer et migrer des serveurs et des bases de données vers Azure.,Il analyse l'infrastructure locale pour estimer les coûts et vérifier la compatibilité des machines avant le déplacement réel.,Qu'est-ce que le Replatforming par rapport au Refactoring ?,Le Replatforming adapte légèrement l'application (ex: changer la base de données) tandis que le Refactoring réécrit le code pour le cloud.,Le Refactoring est plus long et coûteux mais permet d'optimiser au maximum les performances et les coûts d'exploitation dans le cloud.,Pourquoi les conteneurs facilitent-ils la migration hybride ?,Parce qu'ils sont agnostiques vis-à-vis de l'infrastructure et s'exécutent de la même manière partout.,Une application conteneurisée peut être déplacée d'un serveur local vers Kubernetes dans le cloud sans aucune modification du code.,Quel est le rôle d'une liaison dédiée comme AWS Direct Connect ou Azure ExpressRoute ?,Fournir une connexion privée et stable à haut débit entre le datacenter local et le fournisseur cloud.,Contrairement au VPN via Internet ces liaisons offrent une latence réduite et une sécurité accrue pour les migrations massives de données.,Qu'est-ce que la migration de base de données en ligne (Online Migration) ?,C'est un processus qui synchronise les données en continu pendant que l'application reste active.,Cela permet de basculer vers le cloud avec un temps d'arrêt (downtime) quasi nul car la base cible est déjà à jour.,Quel est l'enjeu de la latence dans une architecture hybride ?,Le temps de réponse entre les composants restés en local et ceux migrés dans le cloud.,Si une application dans le cloud communique trop souvent avec une base de données locale les performances peuvent s'effondrer à cause du délai réseau.,À quoi sert Azure File Sync dans un contexte d'hybridation ?,À synchroniser les partages de fichiers locaux avec le stockage cloud Azure Files.,Cela permet de conserver un accès local rapide tout en bénéficiant de la capacité de stockage et de la sauvegarde centralisée dans le cloud.,Comment sécurise-t-on les données lors d'une migration physique par disque (ex: AWS Snowball) ?,En utilisant un chiffrement matériel robuste et des dispositifs de sécurité inviolables pendant le transport.,Pour les volumes de données énormes (pétaoctets) envoyer des disques par transporteur est souvent plus rapide que d'utiliser la connexion internet.
Virtualisation et Datacenter,Gestion des coûts Cloud,Suivi des consommations à l'usage (notions de FinOps).,Qu'est-ce que la démarche FinOps ?,Une pratique de gestion financière du cloud visant à optimiser les coûts par la collaboration des équipes.,FinOps combine la finance l'informatique et le métier pour s'assurer que chaque euro dépensé dans le cloud apporte une valeur maximale à l'entreprise.,Que signifie le modèle de facturation à l'usage (Pay-as-you-go) ?,On ne paie que les ressources réellement consommées à la seconde ou à l'heure.,Cela permet de supprimer les investissements lourds au départ mais nécessite une surveillance constante pour éviter les mauvaises surprises en fin de mois.,À quoi servent les Tags (étiquettes) dans la facturation cloud ?,À identifier et répartir les coûts par projet département ou environnement.,Sans un marquage rigoureux des ressources il est impossible de savoir quelle équipe consomme quoi et de refacturer les services internement.,Qu'est-ce qu'une Instance Réservée (Reserved Instance) ?,Un engagement d'utilisation sur une longue période en échange d'une réduction importante du prix.,Si l'on sait qu'un serveur tournera 24h sur 24 pendant un an s'engager auprès du fournisseur permet d'économiser jusqu'à 70% par rapport au tarif normal.,En quoi consiste le Right-sizing ?,Ajuster la taille des ressources pour qu'elles correspondent exactement aux besoins réels de l'application.,Beaucoup d'entreprises paient pour des serveurs trop puissants qui ne sont utilisés qu'à 10%. Réduire leur taille permet des économies immédiates sans perte de performance.,Quelle est la différence entre CapEx et OpEx dans le contexte du cloud ?,Le CapEx est un investissement en capital (achat matériel) tandis que l'OpEx est une dépense opérationnelle (abonnement).,Le cloud fait passer l'informatique d'un modèle de possession (CapEx) à un modèle de service (OpEx) ce qui offre plus de flexibilité comptable.,Que sont les Instances Spot (ou Preemptible) ?,Des ressources inutilisées vendues à prix cassé mais que le fournisseur peut reprendre à tout moment.,Elles sont idéales pour des calculs non critiques ou des batchs car elles coûtent très peu cher mais ne garantissent pas la disponibilité continue.,Pourquoi mettre en place des Alertes de budget ?,Pour être prévenu dès qu'un seuil de dépense défini est atteint ou dépassé.,C'est un garde-fou essentiel pour éviter qu'une erreur de configuration ou une fuite de ressources ne génère une facture astronomique.,À quoi sert un outil comme AWS Cost Explorer ou Azure Cost Management ?,À visualiser analyser et prévoir ses dépenses cloud via des graphiques et des rapports détaillés.,Ces outils permettent d'identifier les tendances de consommation et de repérer les services qui coûtent le plus cher pour agir rapidement.,Qu'est-ce qu'une ressource zombie (Zombie asset) ?,Une ressource active qui n'est plus utilisée mais continue d'être facturée.,Il peut s'agir d'une adresse IP oubliée d'un volume de stockage détaché ou d'une VM de test jamais éteinte. Les supprimer est la base de l'optimisation.
Continuité et Supervision,Continuité d'activité,"Sauvegardes (Veeam, Veritas), PRA, PCA, PRI, PCI, MCO (Maintien en Condition Opérationnelle), MCS (Maintien en Condition de Sécurité), haute disponibilité applicative.",Quelle est la différence entre un PCA et un PRA ?,Le PCA vise une continuité sans interruption de service tandis que le PRA organise la reprise après un arrêt.,Le Plan de Continuité (PCA) assure la disponibilité immédiate alors que le Plan de Reprise (PRA) accepte un délai de remise en route après un sinistre.,Que signifie l'acronyme MCO ?,Le Maintien en Condition Opérationnelle.,Il s'agit de l'ensemble des mesures prises pour garantir que les systèmes fonctionnent correctement et répondent aux besoins des utilisateurs au quotidien.,Qu'est-ce que le MCS (Maintien en Condition de Sécurité) ?,C'est l'action de maintenir le niveau de protection d'un système face aux nouvelles menaces par des mises à jour régulières.,Le MCS impose l'application des correctifs de sécurité et le suivi des vulnérabilités pour protéger l'infrastructure sur le long terme.,Définissez l'objectif de temps de récupération (RTO).,C'est la durée maximale acceptable d'indisponibilité d'un service après une panne ou un incident.,Un RTO court nécessite des investissements plus lourds en redondance pour garantir un redémarrage rapide des applications critiques.,Qu'est-ce que l'objectif de point de récupération (RPO) ?,C'est la perte de données maximale acceptable exprimée en durée depuis la dernière sauvegarde saine.,Le RPO définit la fréquence des sauvegardes. Un RPO faible signifie que les données doivent être sauvegardées très régulièrement.,Citez un logiciel de sauvegarde leader sur le marché de la virtualisation.,Veeam Backup et Replication.,Cet outil permet de sauvegarder des machines virtuelles de manière efficace et propose des options de restauration ultra rapides en cas de sinistre.,En quoi consiste la règle de sauvegarde 3-2-1 ?,Posséder 3 copies des données sur 2 supports différents avec au moins 1 copie stockée hors site.,C'est la stratégie de référence pour se prémunir contre les pertes de données massives dues à un sinistre physique ou une cyberattaque.,Qu'est-ce que la haute disponibilité (HA) applicative ?,La capacité d'une application à rester accessible malgré la défaillance d'un de ses composants techniques.,On utilise généralement des clusters de serveurs et des répartiteurs de charge (load balancers) pour assurer cette continuité de service.,Quelle est la différence entre un site de repli chaud (Hot Site) et un site froid (Cold Site) ?,Le site chaud est immédiatement opérationnel avec les données synchronisées alors que le site froid nécessite une installation matérielle préalable.,Le choix entre les deux dépend du budget et de la criticité du RTO défini par la direction de l'entreprise.,À quoi sert un test de PRA régulier ?,À vérifier que les procédures de secours sont fonctionnelles et que les équipes savent les appliquer en situation réelle.,Sans tests périodiques un plan de reprise risque d'échouer le jour où un véritable sinistre survient à cause de changements non documentés dans l'infrastructure.
